
15:07:36.298245 IP 125.141.148.234.http > 168.131.152.140.51918: Flags [.], seq 2943994481:2943995941, ack 3630647894, win 1026, length 1460
15:07:36.298284 IP 168.131.152.140.51918 > 125.141.148.234.http: Flags [.], ack 1460, win 256, length 0
15:07:36.298558 IP 125.141.148.234.http > 168.131.152.140.51918: Flags [.], seq 1460:2920, ack 1, win 1026, length 1460
15:07:36.300234 IP 125.141.148.234.http > 168.131.152.140.51918: Flags [.], seq 2920:4380, ack 1, win 1026, length 1460
15:07:36.300285 IP 168.131.152.140.51918 > 125.141.148.234.http: Flags [.], ack 4380, win 256, length 0
15:07:36.302256 IP 125.141.148.234.http > 168.131.152.140.51919: Flags [.], seq 641826076:641827536, ack 3743147532, win 1026, length 1460
15:07:36.302288 IP 168.131.152.140.51919 > 125.141.148.234.http: Flags [.], ack 4294965836, win 256, options [nop,nop,sack 1 {0:1460}], length 0
15:07:36.302549 IP 125.141.148.234.http > 168.131.152.140.51919: Flags [.], seq 1460:2920, ack 1, win 1026, length 1460
15:07:36.302577 IP 168.131.152.140.51919 > 125.141.148.234.http: Flags [.], ack 4294965836, win 256, options [nop,nop,sack 1 {0:2920}], length 0
15:07:36.304381 IP 125.141.148.234.http > 168.131.152.140.51919: Flags [.], seq 2920:4380, ack 1, win 1026, length 1460
15:07:36.304384 IP 125.141.148.234.http > 168.131.152.140.51919: Flags [.], seq 4380:5840, ack 1, win 1026, length 1460
15:07:36.304425 IP 168.131.152.140.51919 > 125.141.148.234.http: Flags [.], ack 4294965836, win 256, options [nop,nop,sack 1 {0:4380}], length 0
15:07:36.304455 IP 168.131.152.140.51919 > 125.141.148.234.http: Flags [.], ack 4294965836, win 256, options [nop,nop,sack 1 {0:5840}], length 0
15:07:36.306229 IP 125.141.148.234.http > 168.131.152.140.51919: Flags [.], seq 5840:7300, ack 1, win 1026, length 1460
15:07:36.306284 IP 168.131.152.140.51919 > 125.141.148.234.http: Flags [.], ack 4294965836, win 256, options [nop,nop,sack 1 {0:7300}], length 0
15:07:36.308279 IP 125.141.148.234.http > 168.131.152.140.51919: Flags [.], seq 7300:8760, ack 1, win 1026, length 1460
15:07:36.308308 IP 168.131.152.140.51919 > 125.141.148.234.http: Flags [.], ack 4294965836, win 256, options [nop,nop,sack 1 {0:8760}], length 0
15:07:36.308564 IP 125.141.148.234.http > 168.131.152.140.51918: Flags [.], seq 4380:5840, ack 1, win 1026, length 1460
15:07:36.310406 IP 125.141.148.234.http > 168.131.152.140.51918: Flags [.], seq 5840:7300, ack 1, win 1026, length 1460
15:07:36.310440 IP 168.131.152.140.51918 > 125.141.148.234.http: Flags [.], ack 7300, win 256, length 0
15:07:36.310716 IP 125.141.148.234.http > 168.131.152.140.51917: Flags [.], seq 3610107622:3610109082, ack 245802464, win 1026, length 1460
15:07:36.310747 IP 168.131.152.140.51917 > 125.141.148.234.http: Flags [.], ack 4294964376, win 256, options [nop,nop,sack 1 {0:1460}], length 0
15:07:36.312322 IP 125.141.148.234.http > 168.131.152.140.51917: Flags [.], seq 2920:4380, ack 1, win 1026, length 1460
15:07:36.312353 IP 168.131.152.140.51917 > 125.141.148.234.http: Flags [.], ack 4294964376, win 256, options [nop,nop,sack 2 {2920:4380}{0:1460}], length 0
15:07:36.314283 IP 125.141.148.234.http > 168.131.152.140.51917: Flags [.], seq 4380:5840, ack 1, win 1026, length 1460
15:07:36.314312 IP 168.131.152.140.51917 > 125.141.148.234.http: Flags [.], ack 4294964376, win 256, options [nop,nop,sack 2 {2920:5840}{0:1460}], length 0
15:07:36.314566 IP 125.141.148.234.http > 168.131.152.140.51920: Flags [.], seq 2431600787:2431602247, ack 2220479090, win 1026, length 1460
15:07:36.314596 IP 168.131.152.140.51920 > 125.141.148.234.http: Flags [.], ack 4294964376, win 256, options [nop,nop,sack 1 {4294965836:1460}], length 0
15:07:36.315268 IP6 fe80::da7:19b2:37bc:745f.58322 > ff02::1:3.hostmon: UDP, length 22
15:07:36.315609 IP 168.131.152.153.55827 > 224.0.0.252.hostmon: UDP, length 22
15:07:36.316203 IP 125.141.148.234.http > 168.131.152.140.51915: Flags [.], seq 5840:7300, ack 1, win 1026, length 1460
15:07:36.316236 IP 168.131.152.140.51915 > 125.141.148.234.http: Flags [.], ack 2920, win 256, options [nop,nop,sack 1 {5840:7300}], length 0
15:07:36.316497 IP 125.141.148.234.http > 168.131.152.140.51913: Flags [.], seq 1934522374:1934523834, ack 163380865, win 1026, length 1460
15:07:36.318288 IP 125.141.148.234.http > 168.131.152.140.51913: Flags [.], seq 1460:2920, ack 1, win 1026, length 1460
15:07:36.318319 IP 168.131.152.140.51913 > 125.141.148.234.http: Flags [.], ack 2920, win 256, length 0
15:07:36.320238 IP 125.141.148.234.http > 168.131.152.140.51913: Flags [.], seq 2920:4380, ack 1, win 1026, length 1460
15:07:36.321897 IP 125.141.148.234.http > 168.131.152.140.51913: Flags [.], seq 4380:5840, ack 1, win 1026, length 1460
15:07:36.321957 IP 168.131.152.140.51913 > 125.141.148.234.http: Flags [.], ack 5840, win 256, length 0
15:07:36.322457 IP 125.141.148.234.http > 168.131.152.140.51913: Flags [.], seq 5840:7300, ack 1, win 1026, length 1460
15:07:36.322459 IP 125.141.148.234.http > 168.131.152.140.51913: Flags [.], seq 7300:8760, ack 1, win 1026, length 1460
15:07:36.322512 IP 168.131.152.140.51913 > 125.141.148.234.http: Flags [.], ack 8760, win 256, length 0
15:07:36.324300 IP 125.141.148.234.http > 168.131.152.140.51913: Flags [.], seq 8760:10220, ack 1, win 1026, length 1460
15:07:36.326339 IP 125.141.148.234.http > 168.131.152.140.51915: Flags [.], seq 7300:8760, ack 1, win 1026, length 1460
15:07:36.326375 IP 168.131.152.140.51915 > 125.141.148.234.http: Flags [.], ack 2920, win 256, options [nop,nop,sack 1 {5840:8760}], length 0
15:07:36.326635 IP 125.141.148.234.http > 168.131.152.140.51915: Flags [.], seq 8760:10220, ack 1, win 1026, length 1460
15:07:36.326665 IP 168.131.152.140.51915 > 125.141.148.234.http: Flags [.], ack 2920, win 256, options [nop,nop,sack 1 {5840:10220}], length 0
15:07:36.328265 IP 125.141.148.234.http > 168.131.152.140.51915: Flags [.], seq 10220:11680, ack 1, win 1026, length 1460
15:07:36.328294 IP 168.131.152.140.51915 > 125.141.148.234.http: Flags [.], ack 2920, win 256, options [nop,nop,sack 1 {5840:11680}], length 0
15:07:36.328551 IP 125.141.148.234.http > 168.131.152.140.51916: Flags [.], seq 359197288:359198748, ack 1712076838, win 1026, length 1460
15:07:36.330339 IP 125.141.148.234.http > 168.131.152.140.51916: Flags [.], seq 1460:2920, ack 1, win 1026, length 1460
15:07:36.330389 IP 168.131.152.140.51916 > 125.141.148.234.http: Flags [.], ack 2920, win 256, length 0
15:07:36.332300 IP 125.141.148.234.http > 168.131.152.140.51916: Flags [.], seq 2920:4380, ack 1, win 1026, length 1460
15:07:36.332559 IP 125.141.148.234.http > 168.131.152.140.51916: Flags [.], seq 4380:5840, ack 1, win 1026, length 1460
15:07:36.332589 IP 168.131.152.140.51916 > 125.141.148.234.http: Flags [.], ack 5840, win 256, length 0
15:07:36.334317 IP 125.141.148.234.http > 168.131.152.140.51916: Flags [.], seq 5840:7300, ack 1, win 1026, length 1460
15:07:36.337295 IP 125.141.148.234.http > 168.131.152.140.51916: Flags [.], seq 7300:8760, ack 1, win 1026, length 1460
15:07:36.337297 IP 125.141.148.234.http > 168.131.152.140.51920: Flags [.], seq 1460:2920, ack 1, win 1026, length 1460
15:07:36.337368 IP 168.131.152.140.51920 > 125.141.148.234.http: Flags [.], ack 4294964376, win 256, options [nop,nop,sack 1 {4294965836:2920}], length 0
15:07:36.337402 IP 168.131.152.140.51916 > 125.141.148.234.http: Flags [.], ack 8760, win 256, length 0
15:07:36.338351 IP 125.141.148.234.http > 168.131.152.140.51920: Flags [.], seq 2920:4380, ack 1, win 1026, length 1460
15:07:36.338383 IP 168.131.152.140.51920 > 125.141.148.234.http: Flags [.], ack 4294964376, win 256, options [nop,nop,sack 1 {4294965836:4380}], length 0
15:07:36.338645 IP 125.141.148.234.http > 168.131.152.140.51920: Flags [.], seq 4380:5840, ack 1, win 1026, length 1460
15:07:36.338674 IP 168.131.152.140.51920 > 125.141.148.234.http: Flags [.], ack 4294964376, win 256, options [nop,nop,sack 1 {4294965836:5840}], length 0
15:07:36.340283 IP 125.141.148.234.http > 168.131.152.140.51920: Flags [.], seq 5840:7300, ack 1, win 1026, length 1460
15:07:36.340313 IP 168.131.152.140.51920 > 125.141.148.234.http: Flags [.], ack 4294964376, win 256, options [nop,nop,sack 1 {4294965836:7300}], length 0
15:07:36.342327 IP 125.141.148.234.http > 168.131.152.140.51920: Flags [.], seq 7300:8760, ack 1, win 1026, length 1460
15:07:36.342358 IP 168.131.152.140.51920 > 125.141.148.234.http: Flags [.], ack 4294964376, win 256, options [nop,nop,sack 1 {4294965836:8760}], length 0
15:07:36.342631 IP 125.141.148.234.http > 168.131.152.140.51920: Flags [.], seq 8760:10220, ack 1, win 1026, length 1460
15:07:36.342665 IP 168.131.152.140.51920 > 125.141.148.234.http: Flags [.], ack 4294964376, win 256, options [nop,nop,sack 1 {4294965836:10220}], length 0
15:07:36.344362 IP 125.141.148.234.http > 168.131.152.140.51914: Flags [.], seq 4294952696:4294954156, ack 1, win 1026, length 1460
15:07:36.344403 IP 168.131.152.140.51914 > 125.141.148.234.http: Flags [.], ack 4294954156, win 256, options [nop,nop,sack 2 {0:1460}{4294958536:4294965836}], length 0
15:07:36.344690 IP 125.141.148.234.http > 168.131.152.140.51914: Flags [.], seq 4294954156:4294955616, ack 1, win 1026, length 1460
15:07:36.344757 IP 168.131.152.140.51914 > 125.141.148.234.http: Flags [.], ack 4294955616, win 256, options [nop,nop,sack 2 {0:1460}{4294958536:4294965836}], length 0
15:07:36.346325 IP 125.141.148.234.http > 168.131.152.140.51919: Flags [.], seq 8760:10220, ack 1, win 1026, length 1460
15:07:36.346360 IP 168.131.152.140.51919 > 125.141.148.234.http: Flags [.], ack 4294965836, win 256, options [nop,nop,sack 1 {0:10220}], length 0
15:07:36.348329 IP 125.141.148.234.http > 168.131.152.140.51919: Flags [.], seq 10220:11680, ack 1, win 1026, length 1460
15:07:36.348363 IP 168.131.152.140.51919 > 125.141.148.234.http: Flags [.], ack 4294965836, win 256, options [nop,nop,sack 1 {0:11680}], length 0
15:07:36.348646 IP 125.141.148.234.http > 168.131.152.140.51919: Flags [.], seq 11680:13140, ack 1, win 1026, length 1460
15:07:36.348680 IP 168.131.152.140.51919 > 125.141.148.234.http: Flags [.], ack 4294965836, win 256, options [nop,nop,sack 1 {0:13140}], length 0
15:07:36.350289 IP 125.141.148.234.http > 168.131.152.140.51915: Flags [.], seq 11680:13140, ack 1, win 1026, length 1460
15:07:36.350317 IP 168.131.152.140.51915 > 125.141.148.234.http: Flags [.], ack 2920, win 256, options [nop,nop,sack 1 {5840:13140}], length 0
15:07:36.350572 IP 125.141.148.234.http > 168.131.152.140.51915: Flags [.], seq 13140:14600, ack 1, win 1026, length 1460
15:07:36.350597 IP 168.131.152.140.51915 > 125.141.148.234.http: Flags [.], ack 2920, win 256, options [nop,nop,sack 1 {5840:14600}], length 0
15:07:36.353019 IP 125.141.148.234.http > 168.131.152.140.51915: Flags [.], seq 14600:16060, ack 1, win 1026, length 1460
15:07:36.353083 IP 168.131.152.140.51915 > 125.141.148.234.http: Flags [.], ack 2920, win 256, options [nop,nop,sack 1 {5840:16060}], length 0
15:07:36.354295 IP 125.141.148.234.http > 168.131.152.140.51915: Flags [.], seq 16060:17520, ack 1, win 1026, length 1460
15:07:36.354330 IP 168.131.152.140.51915 > 125.141.148.234.http: Flags [.], ack 2920, win 256, options [nop,nop,sack 1 {5840:17520}], length 0
15:07:36.354616 IP 125.141.148.234.http > 168.131.152.140.51915: Flags [.], seq 17520:18980, ack 1, win 1026, length 1460
15:07:36.354651 IP 168.131.152.140.51915 > 125.141.148.234.http: Flags [.], ack 2920, win 256, options [nop,nop,sack 1 {5840:18980}], length 0
15:07:36.356318 IP 125.141.148.234.http > 168.131.152.140.51915: Flags [.], seq 18980:20440, ack 1, win 1026, length 1460
15:07:36.356354 IP 168.131.152.140.51915 > 125.141.148.234.http: Flags [.], ack 2920, win 256, options [nop,nop,sack 1 {5840:20440}], length 0
15:07:36.356635 IP 125.141.148.234.http > 168.131.152.140.51914: Flags [.], seq 4294955616:4294957076, ack 1, win 1026, length 1460
15:07:36.356681 IP 168.131.152.140.51914 > 125.141.148.234.http: Flags [.], ack 4294957076, win 256, options [nop,nop,sack 2 {0:1460}{4294958536:4294965836}], length 0
15:07:36.358352 IP 125.141.148.234.http > 168.131.152.140.51918: Flags [.], seq 7300:8760, ack 1, win 1026, length 1460
15:07:36.360327 IP 125.141.148.234.http > 168.131.152.140.51918: Flags [.], seq 8760:10220, ack 1, win 1026, length 1460
15:07:36.360399 IP 168.131.152.140.51918 > 125.141.148.234.http: Flags [.], ack 10220, win 256, length 0
15:07:36.360705 IP 125.141.148.234.http > 168.131.152.140.51918: Flags [.], seq 10220:11680, ack 1, win 1026, length 1460
15:07:36.362375 IP 125.141.148.234.http > 168.131.152.140.51918: Flags [.], seq 11680:13140, ack 1, win 1026, length 1460
15:07:36.362411 IP 168.131.152.140.51918 > 125.141.148.234.http: Flags [.], ack 13140, win 256, length 0
15:07:36.362697 IP 125.141.148.234.http > 168.131.152.140.51918: Flags [.], seq 13140:14600, ack 1, win 1026, length 1460
15:07:36.364316 IP 125.141.148.234.http > 168.131.152.140.51919: Flags [.], seq 13140:14600, ack 1, win 1026, length 1460
15:07:36.364351 IP 168.131.152.140.51919 > 125.141.148.234.http: Flags [.], ack 4294965836, win 256, options [nop,nop,sack 1 {0:14600}], length 0
15:07:36.366325 IP 125.141.148.234.http > 168.131.152.140.51919: Flags [.], seq 14600:16060, ack 1, win 1026, length 1460
15:07:36.366355 IP 168.131.152.140.51919 > 125.141.148.234.http: Flags [.], ack 4294965836, win 256, options [nop,nop,sack 1 {0:16060}], length 0
15:07:36.366600 IP 125.141.148.234.http > 168.131.152.140.51919: Flags [.], seq 4294965836:0, ack 1, win 1026, length 1460
15:07:36.366674 IP 168.131.152.140.51919 > 125.141.148.234.http: Flags [.], ack 16060, win 256, length 0
15:07:36.368481 IP 125.141.148.234.http > 168.131.152.140.51918: Flags [.], seq 14600:16060, ack 1, win 1026, length 1460
15:07:36.368483 IP 125.141.148.234.http > 168.131.152.140.51918: Flags [.], seq 16060:17520, ack 1, win 1026, length 1460
15:07:36.368548 IP 168.131.152.140.51918 > 125.141.148.234.http: Flags [.], ack 17520, win 256, length 0
15:07:36.370391 IP 125.141.148.234.http > 168.131.152.140.51917: Flags [.], seq 5840:7300, ack 1, win 1026, length 1460
15:07:36.370432 IP 168.131.152.140.51917 > 125.141.148.234.http: Flags [.], ack 4294964376, win 256, options [nop,nop,sack 2 {2920:7300}{0:1460}], length 0
15:07:36.372260 IP 125.141.148.234.http > 168.131.152.140.51917: Flags [.], seq 7300:8760, ack 1, win 1026, length 1460
15:07:36.372294 IP 168.131.152.140.51917 > 125.141.148.234.http: Flags [.], ack 4294964376, win 256, options [nop,nop,sack 2 {2920:8760}{0:1460}], length 0
15:07:36.372582 IP 125.141.148.234.http > 168.131.152.140.51917: Flags [.], seq 4294964376:4294965836, ack 1, win 1026, length 1460
15:07:36.372620 IP 168.131.152.140.51917 > 125.141.148.234.http: Flags [.], ack 4294965836, win 256, options [nop,nop,sack 2 {2920:8760}{0:1460}], length 0
15:07:36.374343 IP 125.141.148.234.http > 168.131.152.140.51920: Flags [.], seq 10220:11680, ack 1, win 1026, length 1460
15:07:36.374379 IP 168.131.152.140.51920 > 125.141.148.234.http: Flags [.], ack 4294964376, win 256, options [nop,nop,sack 1 {4294965836:11680}], length 0
15:07:36.374657 IP 125.141.148.234.http > 168.131.152.140.51915: Flags [.], seq 20440:21900, ack 1, win 1026, length 1460
15:07:36.374693 IP 168.131.152.140.51915 > 125.141.148.234.http: Flags [.], ack 2920, win 256, options [nop,nop,sack 1 {5840:21900}], length 0
15:07:36.376319 IP 125.141.148.234.http > 168.131.152.140.51913: Flags [.], seq 10220:11680, ack 1, win 1026, length 1460
15:07:36.376357 IP 168.131.152.140.51913 > 125.141.148.234.http: Flags [.], ack 11680, win 256, length 0
15:07:36.378318 IP 125.141.148.234.http > 168.131.152.140.51913: Flags [.], seq 11680:13140, ack 1, win 1026, length 1460
15:07:36.378621 IP 125.141.148.234.http > 168.131.152.140.51913: Flags [.], seq 13140:14600, ack 1, win 1026, length 1460
15:07:36.378658 IP 168.131.152.140.51913 > 125.141.148.234.http: Flags [.], ack 14600, win 256, length 0
15:07:36.379826 STP 802.1s, Rapid STP, CIST Flags [Learn, Forward, Agreement]
15:07:36.380239 IP 125.141.148.234.http > 168.131.152.140.51913: Flags [.], seq 14600:16060, ack 1, win 1026, length 1460
15:07:36.384046 IP 125.141.148.234.http > 168.131.152.140.51913: Flags [.], seq 16060:17520, ack 1, win 1026, length 1460
15:07:36.384049 IP 125.141.148.234.http > 168.131.152.140.51913: Flags [.], seq 17520:18980, ack 1, win 1026, length 1460
15:07:36.384115 IP 168.131.152.140.51913 > 125.141.148.234.http: Flags [.], ack 18980, win 256, length 0
15:07:36.384395 IP 125.141.148.234.http > 168.131.152.140.51913: Flags [.], seq 18980:20440, ack 1, win 1026, length 1460
15:07:36.384397 IP 125.141.148.234.http > 168.131.152.140.51915: Flags [.], seq 21900:23360, ack 1, win 1026, length 1460
15:07:36.384446 IP 168.131.152.140.51915 > 125.141.148.234.http: Flags [.], ack 2920, win 256, options [nop,nop,sack 1 {5840:23360}], length 0
15:07:36.384473 IP 168.131.152.140.51913 > 125.141.148.234.http: Flags [.], ack 20440, win 256, length 0
15:07:36.386394 IP 125.141.148.234.http > 168.131.152.140.51916: Flags [.], seq 8760:10220, ack 1, win 1026, length 1460
15:07:36.388275 IP 125.141.148.234.http > 168.131.152.140.51916: Flags [.], seq 10220:11680, ack 1, win 1026, length 1460
15:07:36.388312 IP 168.131.152.140.51916 > 125.141.148.234.http: Flags [.], ack 11680, win 256, length 0
15:07:36.388607 IP 125.141.148.234.http > 168.131.152.140.51916: Flags [.], seq 11680:13140, ack 1, win 1026, length 1460


